[
  {
    "id": "personal-media", "name": "Personal media", "aliases": ["netflix", "my own netflix", "personal streaming", "media stack"], "summary": "Request, acquire, organize, and play a private movie and TV library.", "categories": ["media", "requests", "downloads", "dashboard"], "automation": "managed",
    "roles": [
      {"id": "dashboard", "name": "Dashboard", "required": true, "default": "homarr", "choices": ["homarr"], "reason": "Expose the supported integrations and health in one private entry point.", "gates": ["exposure"]},
      {"id": "playback", "name": "Playback", "required": true, "default": "jellyfin", "choices": ["jellyfin", "plex", "emby"], "reason": "Serve the owned media library to approved clients.", "gates": ["storage", "hardware"]},
      {"id": "requests", "name": "Requests", "required": true, "default": "seerr", "choices": ["seerr"], "reason": "Connect user requests to movie and TV automation.", "gates": ["secrets"]},
      {"id": "tv", "name": "TV automation", "required": true, "default": "sonarr", "choices": ["sonarr"], "reason": "Manage television library intent and imports.", "gates": ["storage", "secrets"]},
      {"id": "movies", "name": "Movie automation", "required": true, "default": "radarr", "choices": ["radarr"], "reason": "Manage movie library intent and imports.", "gates": ["storage", "secrets"]},
      {"id": "indexers", "name": "Indexer management", "required": true, "default": "prowlarr", "choices": ["prowlarr"], "reason": "Keep indexer configuration synchronized with the automation apps.", "gates": ["secrets", "legal"]},
      {"id": "downloader", "name": "Downloader", "required": true, "default": "qbittorrent", "choices": ["qbittorrent", "sabnzbd"], "reason": "Provide one selected acquisition path with shared storage semantics.", "gates": ["storage", "legal"]},
      {"id": "subtitles", "name": "Subtitles", "required": false, "default": null, "choices": ["bazarr"], "reason": "Add subtitle automation only when requested.", "gates": ["storage", "secrets"]},
      {"id": "downloader-vpn", "name": "Downloader VPN", "required": false, "default": null, "choices": ["gluetun"], "reason": "Route only the downloader through a user-selected VPN with failure evidence.", "gates": ["vpn", "privilege"]}
    ],
    "requiredSkills": ["selfhost-host", "selfhost-media", "selfhost-homarr", "selfhost-compose", "selfhost-verify"], "gates": ["storage", "exposure", "legal", "secrets", "migration"],
    "acceptance": ["Every selected application is API-ready on service-name DNS.", "Seerr reaches playback plus the selected Arr services.", "Homarr integrations and relevant widgets return data.", "Shared paths support the selected import and hardlink policy."]
  },
  {
    "id": "photos", "name": "Photos and mobile backup", "aliases": ["photos", "replace google photos", "google photos replacement", "phone photo backup"], "summary": "Keep original photos private while providing mobile backup, search, and recovery.", "categories": ["photos"], "automation": "guided",
    "roles": [
      {"id": "photo-library", "name": "Photo library", "required": true, "default": "immich", "choices": ["immich", "photoprism"], "reason": "Own the photo index, original files, and client experience.", "gates": ["storage", "migration", "hardware"]},
      {"id": "dashboard", "name": "Dashboard", "required": false, "default": null, "choices": ["homarr"], "reason": "Link the photo service without treating the dashboard as its backup owner.", "gates": ["exposure"]}
    ],
    "requiredSkills": ["selfhost-host", "selfhost-compose", "selfhost-backup", "selfhost-verify"], "gates": ["storage", "backup", "exposure", "migration"],
    "acceptance": ["A test upload is visible from an approved client.", "Originals and application database have separate protected backup coverage.", "A restore drill proves metadata and one original can be recovered."]
  },
  {
    "id": "documents", "name": "Documents, PDF, and OCR", "aliases": ["documents", "pdf", "paperless", "scan documents", "ocr"], "summary": "Ingest, OCR, search, transform, and recover private documents.", "categories": ["documents"], "automation": "guided",
    "roles": [
      {"id": "archive", "name": "Document archive", "required": true, "default": "paperless-ngx", "choices": ["paperless-ngx", "mayan-edms"], "reason": "Own durable ingest, metadata, OCR, search, and export.", "gates": ["storage", "backup", "privacy"]},
      {"id": "pdf-tools", "name": "PDF toolbox", "required": false, "default": null, "choices": ["stirling-pdf"], "reason": "Add private PDF transformations without confusing them with archival storage.", "gates": ["privacy", "exposure"]}
    ],
    "requiredSkills": ["selfhost-host", "selfhost-compose", "selfhost-backup", "selfhost-verify"], "gates": ["storage", "backup", "privacy", "exposure"],
    "acceptance": ["A test document is ingested, OCR text is searchable, and the original exports.", "Database, media, and export paths have an app-consistent restore procedure."]
  },
  {
    "id": "files", "name": "Files and synchronization", "aliases": ["files", "replace dropbox", "dropbox replacement", "replace google drive"], "summary": "Choose between cloud collaboration and peer synchronization with explicit recovery.", "categories": ["files"], "automation": "guided",
    "roles": [
      {"id": "file-service", "name": "File service", "required": true, "default": "nextcloud", "choices": ["nextcloud", "syncthing", "seafile"], "reason": "Match collaborative cloud storage or device synchronization to the real goal.", "gates": ["storage", "backup", "exposure"]}
    ],
    "requiredSkills": ["selfhost-host", "selfhost-compose", "selfhost-backup", "selfhost-ingress", "selfhost-verify"], "gates": ["storage", "backup", "exposure", "migration"],
    "acceptance": ["A representative file round-trips through the selected clients.", "Deletion propagation and conflict policy are documented.", "A separate backup recovers data independently from synchronization."]
  },
  {
    "id": "passwords", "name": "Passwords", "aliases": ["passwords", "password manager", "self hosted vault"], "summary": "Host a recovery-sensitive password vault behind private, authenticated TLS.", "categories": ["passwords"], "automation": "guided",
    "roles": [
      {"id": "vault", "name": "Password vault", "required": true, "default": "vaultwarden", "choices": ["vaultwarden", "passbolt"], "reason": "Provide encrypted client access with an explicit recovery model.", "gates": ["exposure", "backup", "secrets", "migration"]}
    ],
    "requiredSkills": ["selfhost-host", "selfhost-compose", "selfhost-ingress", "selfhost-backup", "selfhost-verify"], "gates": ["exposure", "backup", "secrets", "migration"],
    "acceptance": ["TLS, login, lockout, and recovery are tested from an approved client.", "An encrypted export and full restore drill succeed without exposing secret values."]
  },
  {
    "id": "home-automation", "name": "Home automation", "aliases": ["home automation", "smart home", "home assistant"], "summary": "Run a private automation hub with deliberate LAN discovery and device privileges.", "categories": ["home-automation", "cameras"], "automation": "guided",
    "roles": [
      {"id": "hub", "name": "Automation hub", "required": true, "default": "home-assistant", "choices": ["home-assistant", "homebridge"], "reason": "Own device state, automations, and client access.", "gates": ["privilege", "network", "backup"]},
      {"id": "flows", "name": "Automation flows", "required": false, "default": null, "choices": ["node-red"], "reason": "Add visual flows only when their control scope is understood.", "gates": ["privilege", "secrets"]},
      {"id": "cameras", "name": "Camera NVR", "required": false, "default": null, "choices": ["frigate"], "reason": "Add local recording and detection only with hardware and retention planning.", "gates": ["hardware", "storage", "privacy"]}
    ],
    "requiredSkills": ["selfhost-host", "selfhost-compose", "selfhost-backup", "selfhost-verify"], "gates": ["privilege", "network", "storage", "privacy", "backup"],
    "acceptance": ["Required LAN devices remain discoverable after restart.", "A test automation executes without granting unrelated host control.", "Configuration and device recovery steps are verified."]
  },
  {
    "id": "remote-access", "name": "Remote access", "aliases": ["remote access", "access online", "access from phone", "make accessible remotely", "vpn"], "summary": "Expose selected services through a private overlay or separately approved public edge.", "categories": ["remote-access", "ingress", "identity"], "automation": "guided",
    "roles": [
      {"id": "private-overlay", "name": "Private overlay", "required": true, "default": "tailscale", "choices": ["tailscale", "headscale", "netbird", "wireguard"], "reason": "Prefer identity-aware private access for trusted devices.", "gates": ["network", "secrets"]},
      {"id": "public-tunnel", "name": "Public tunnel", "required": false, "default": null, "choices": ["cloudflare-tunnel", "pangolin"], "reason": "Add public reachability only when the user needs it and accepts the provider or VPS boundary.", "gates": ["public-exposure", "identity", "secrets"]},
      {"id": "reverse-proxy", "name": "Reverse proxy", "required": false, "default": null, "choices": ["caddy", "traefik", "nginx-proxy-manager"], "reason": "Reuse one existing DNS/TLS/port owner or select one explicitly.", "gates": ["public-exposure", "privilege"]}
    ],
    "requiredSkills": ["selfhost-host", "selfhost-ingress", "selfhost-verify"], "gates": ["network", "public-exposure", "identity", "secrets", "privilege"],
    "acceptance": ["The intended client resolves and reaches only the selected service.", "TLS and identity policy are valid for public routes.", "Direct management ports remain private."]
  },
  {